{"format_version":"1.0.0","capture_kind":"ordinary_video_import","session_id":"session_00000000-0000-4000-8000-000000000002","source":{"device_model":"fixture","os_version":"1","app_version":"1","build_id":"fixture","recorded_at_utc":"2026-07-16T00:00:00Z"},"files":[{"relative_path":"media/source.mp4","media_type":"video/mp4","codec":"h264_video","byte_length":4,"sha256":"9f86d081884c7d659a2feaa0c55ad015a3bf4f1b2b0b822cd15d6c15b0f00a08","role":"ordinary_video"}],"journal":[{"journal_sequence":0,"monotonic_timestamp_ns":"0","entry_type":"event","reference_id":"event_00000000-0000-4000-8000-000000000002","content_sha256":"0000000000000000000000000000000000000000000000000000000000000000"}],"accepted_frame_order":[],"keyframes":[],"events":[{"event_id":"event_00000000-0000-4000-8000-000000000002","event_sequence":0,"durable_journal_sequence":0,"monotonic_timestamp_ns":"0","type":"ordinary_video_imported","payload_sha256":"0000000000000000000000000000000000000000000000000000000000000000","payload_path":"events/import.json","record_sha256_algorithm":"RR-JCS-SHA256-1","record_sha256_scope":"entire_event_record_with_record_sha256_member_omitted","record_sha256":"0000000000000000000000000000000000000000000000000000000000000000"}],"replay":{"ordering_authority":"global_journal_sequence","input_digest_algorithm":"RR-JCS-SHA256-1","input_digest_scope":"jcs_array_of_journal_sequence_entry_type_reference_id_content_sha256","input_digest":"0000000000000000000000000000000000000000000000000000000000000000","neural_determinism":"tolerance_based_when_provider_pinned","provider_lock":[]},"privacy":{"capture_consent_recorded":true,"contains_room_imagery":true,"retention_policy":"local_only_until_share","deletion_state":"none","share_access_state":"not_shared"},"finalization":{"state":"finalized","manifest_sha256_algorithm":"RR-JCS-SHA256-1","manifest_sha256_scope":"entire_manifest_with_finalization_manifest_sha256_member_omitted","manifest_sha256":"0000000000000000000000000000000000000000000000000000000000000000","last_durable_journal_sequence":0},"ordinary_video":{"file_path":"media/source.mp4","sha256":"9f86d081884c7d659a2feaa0c55ad015a3bf4f1b2b0b822cd15d6c15b0f00a08","container":"mp4","video_codec":"h264_video","timeline_timebase":"1/30","calibration_state":"uncalibrated_no_world_authority","replay_guarantee":"decode_and_timeline_only","learned_geometry_state":"unavailable"}}
